{
  "$schema": "./tokens-schema.json",
  "version": "0.1.0",
  "lastUpdated": "2025-11-01",
  "baseTokens": {
    "colors": {
      "Color.Primary": {
        "type": "color",
        "defaultValue": "#6750A4",
        "darkValue": "#D0BCFF",
        "purpose": "Main brand color, used for primary actions and key UI elements",
        "category": "primary"
      },
      "Color.OnPrimary": {
        "type": "color",
        "defaultValue": "#FFFFFF",
        "darkValue": "#381E72",
        "purpose": "Text and icons displayed on primary color",
        "category": "primary"
      },
      "Color.PrimaryContainer": {
        "type": "color",
        "defaultValue": "#EADDFF",
        "darkValue": "#4F378B",
        "purpose": "Containers and backgrounds for primary-related elements",
        "category": "primary"
      },
      "Color.OnPrimaryContainer": {
        "type": "color",
        "defaultValue": "#21005D",
        "darkValue": "#EADDFF",
        "purpose": "Text and icons on primary containers",
        "category": "primary"
      },
      "Color.Secondary": {
        "type": "color",
        "defaultValue": "#625B71",
        "darkValue": "#CCC2DC",
        "purpose": "Secondary actions and less prominent UI elements",
        "category": "secondary"
      },
      "Color.OnSecondary": {
        "type": "color",
        "defaultValue": "#FFFFFF",
        "darkValue": "#332D41",
        "purpose": "Text and icons on secondary color",
        "category": "secondary"
      },
      "Color.SecondaryContainer": {
        "type": "color",
        "defaultValue": "#E8DEF8",
        "darkValue": "#4A4458",
        "purpose": "Containers for secondary-related elements",
        "category": "secondary"
      },
      "Color.OnSecondaryContainer": {
        "type": "color",
        "defaultValue": "#1D192B",
        "darkValue": "#E8DEF8",
        "purpose": "Text and icons on secondary containers",
        "category": "secondary"
      },
      "Color.Tertiary": {
        "type": "color",
        "defaultValue": "#7D5260",
        "darkValue": "#EFB8C8",
        "purpose": "Accent color for additional visual hierarchy",
        "category": "tertiary"
      },
      "Color.OnTertiary": {
        "type": "color",
        "defaultValue": "#FFFFFF",
        "darkValue": "#492532",
        "purpose": "Text and icons on tertiary color",
        "category": "tertiary"
      },
      "Color.TertiaryContainer": {
        "type": "color",
        "defaultValue": "#FFD8E4",
        "darkValue": "#633B48",
        "purpose": "Containers for tertiary-related elements",
        "category": "tertiary"
      },
      "Color.OnTertiaryContainer": {
        "type": "color",
        "defaultValue": "#31111D",
        "darkValue": "#FFD8E4",
        "purpose": "Text and icons on tertiary containers",
        "category": "tertiary"
      },
      "Color.Error": {
        "type": "color",
        "defaultValue": "#B3261E",
        "darkValue": "#F2B8B5",
        "purpose": "Error states, destructive actions, critical alerts",
        "category": "error"
      },
      "Color.OnError": {
        "type": "color",
        "defaultValue": "#FFFFFF",
        "darkValue": "#601410",
        "purpose": "Text and icons on error color",
        "category": "error"
      },
      "Color.ErrorContainer": {
        "type": "color",
        "defaultValue": "#F9DEDC",
        "darkValue": "#8C1D18",
        "purpose": "Containers for error-related messages",
        "category": "error"
      },
      "Color.OnErrorContainer": {
        "type": "color",
        "defaultValue": "#410E0B",
        "darkValue": "#F9DEDC",
        "purpose": "Text and icons on error containers",
        "category": "error"
      },
      "Color.Surface": {
        "type": "color",
        "defaultValue": "#FFFBFE",
        "darkValue": "#1C1B1F",
        "purpose": "Main background surface color",
        "category": "surface"
      },
      "Color.OnSurface": {
        "type": "color",
        "defaultValue": "#1C1B1F",
        "darkValue": "#E6E1E5",
        "purpose": "Text and icons on surface",
        "category": "surface"
      },
      "Color.SurfaceVariant": {
        "type": "color",
        "defaultValue": "#E7E0EC",
        "darkValue": "#49454F",
        "purpose": "Alternative surface color for emphasis",
        "category": "surface"
      },
      "Color.OnSurfaceVariant": {
        "type": "color",
        "defaultValue": "#49454F",
        "darkValue": "#CAC4D0",
        "purpose": "Text and icons on surface variants",
        "category": "surface"
      },
      "Color.Background": {
        "type": "color",
        "defaultValue": "#FFFBFE",
        "darkValue": "#1C1B1F",
        "purpose": "Main background color behind surfaces",
        "category": "background"
      },
      "Color.OnBackground": {
        "type": "color",
        "defaultValue": "#1C1B1F",
        "darkValue": "#E6E1E5",
        "purpose": "Text and icons on background",
        "category": "background"
      },
      "Color.Outline": {
        "type": "color",
        "defaultValue": "#79747E",
        "darkValue": "#938F99",
        "purpose": "Important borders and dividers",
        "category": "outline"
      },
      "Color.OutlineVariant": {
        "type": "color",
        "defaultValue": "#CAC4D0",
        "darkValue": "#49454F",
        "purpose": "Subtle borders and dividers",
        "category": "outline"
      },
      "Color.InverseSurface": {
        "type": "color",
        "defaultValue": "#313033",
        "darkValue": "#E6E1E5",
        "purpose": "Inverse surface (e.g., dark tooltips in light mode)",
        "category": "inverse"
      },
      "Color.InverseOnSurface": {
        "type": "color",
        "defaultValue": "#F4EFF4",
        "darkValue": "#313033",
        "purpose": "Text and icons on inverse surface",
        "category": "inverse"
      },
      "Color.InversePrimary": {
        "type": "color",
        "defaultValue": "#D0BCFF",
        "darkValue": "#6750A4",
        "purpose": "Primary color for inverse elements",
        "category": "inverse"
      }
    },
    "spacing": {
      "Space.0": {
        "type": "spacing",
        "value": 0,
        "unit": "dip",
        "purpose": "No spacing"
      },
      "Space.2": {
        "type": "spacing",
        "value": 2,
        "unit": "dip",
        "purpose": "Minimal spacing between very tight elements"
      },
      "Space.4": {
        "type": "spacing",
        "value": 4,
        "unit": "dip",
        "purpose": "Tight spacing"
      },
      "Space.8": {
        "type": "spacing",
        "value": 8,
        "unit": "dip",
        "purpose": "Standard small spacing"
      },
      "Space.12": {
        "type": "spacing",
        "value": 12,
        "unit": "dip",
        "purpose": "Medium-small spacing"
      },
      "Space.16": {
        "type": "spacing",
        "value": 16,
        "unit": "dip",
        "purpose": "Standard spacing (most common)"
      },
      "Space.20": {
        "type": "spacing",
        "value": 20,
        "unit": "dip",
        "purpose": "Medium-large spacing"
      },
      "Space.24": {
        "type": "spacing",
        "value": 24,
        "unit": "dip",
        "purpose": "Large spacing"
      },
      "Space.32": {
        "type": "spacing",
        "value": 32,
        "unit": "dip",
        "purpose": "Extra large spacing"
      },
      "Space.40": {
        "type": "spacing",
        "value": 40,
        "unit": "dip",
        "purpose": "Section separation"
      },
      "Space.48": {
        "type": "spacing",
        "value": 48,
        "unit": "dip",
        "purpose": "Major section separation"
      }
    },
    "typography": {
      "FontSize.DisplayLarge": {
        "type": "fontSize",
        "value": 57,
        "unit": "sp",
        "purpose": "Largest display text (hero headlines)"
      },
      "FontSize.DisplayMedium": {
        "type": "fontSize",
        "value": 45,
        "unit": "sp",
        "purpose": "Medium display text"
      },
      "FontSize.DisplaySmall": {
        "type": "fontSize",
        "value": 36,
        "unit": "sp",
        "purpose": "Small display text"
      },
      "FontSize.HeadlineLarge": {
        "type": "fontSize",
        "value": 32,
        "unit": "sp",
        "purpose": "Large headline text"
      },
      "FontSize.HeadlineMedium": {
        "type": "fontSize",
        "value": 28,
        "unit": "sp",
        "purpose": "Medium headline text"
      },
      "FontSize.HeadlineSmall": {
        "type": "fontSize",
        "value": 24,
        "unit": "sp",
        "purpose": "Small headline text"
      },
      "FontSize.TitleLarge": {
        "type": "fontSize",
        "value": 22,
        "unit": "sp",
        "purpose": "Large title text (page titles)"
      },
      "FontSize.TitleMedium": {
        "type": "fontSize",
        "value": 16,
        "unit": "sp",
        "purpose": "Medium title text (card titles)"
      },
      "FontSize.TitleSmall": {
        "type": "fontSize",
        "value": 14,
        "unit": "sp",
        "purpose": "Small title text (list headers)"
      },
      "FontSize.BodyLarge": {
        "type": "fontSize",
        "value": 16,
        "unit": "sp",
        "purpose": "Large body text (emphasized content)"
      },
      "FontSize.BodyMedium": {
        "type": "fontSize",
        "value": 14,
        "unit": "sp",
        "purpose": "Medium body text (standard content)"
      },
      "FontSize.BodySmall": {
        "type": "fontSize",
        "value": 12,
        "unit": "sp",
        "purpose": "Small body text (supporting text)"
      },
      "FontSize.LabelLarge": {
        "type": "fontSize",
        "value": 14,
        "unit": "sp",
        "purpose": "Large label text (prominent buttons)"
      },
      "FontSize.LabelMedium": {
        "type": "fontSize",
        "value": 12,
        "unit": "sp",